<?xml version="1.0" encoding="UTF-8"?>
<!DOCTYPE facturas SYSTEM "ej7_facturas.dtd">
<facturas>
    <factura numero="F001">
        <membrete>
            <cif>B86784572</cif>
            <razonSocial>Empresa ABC S.L.</razonSocial>
            <direccion>Calle Mayor, 123</direccion>
            <codigoPostal>28001</codigoPostal>
            <poblacion>Madrid</poblacion>
            <telefono>912345678</telefono>
            <email>info@empresaabc.com</email>
        </membrete>
        <fecha>14/12/2013</fecha>
        <cliente>
            <dni>53787675B</dni>
            <nombre>Juan Pérez</nombre>
            <direccion>Calle Secundaria, 45</direccion>
            <codigoPostal>28002</codigoPostal>
            <poblacion>Sevilla</poblacion>
        </cliente>
        <productos>
            <producto codigo="P001">
                <cantidad>2</cantidad>
                <descripcion>Redmi Note 13</descripcion>
                <precioUnitario>200</precioUnitario>
                <iva>21%</iva>
            </producto>
            <producto codigo="P002">
                <cantidad>1</cantidad>
                <descripcion>Portatil Asus</descripcion>
                <precioUnitario>300</precioUnitario>
                <iva>21%</iva>
            </producto>
            <producto codigo="P003">
                <cantidad>3</cantidad>
                <descripcion>Teclado Mecánico RGB</descripcion>
                <precioUnitario>20</precioUnitario>
                <iva>21%</iva>
            </producto>
        </productos>
        <resumen>
            <formaPago>tarjeta</formaPago>
        </resumen>
    </factura>
    <factura numero="F002">
        <membrete>
            <cif>B87654321</cif>
            <razonSocial>Empresa XYZ S.L.</razonSocial>
            <direccion>Avenida Central, 89</direccion>
            <codigoPostal>30001</codigoPostal>
            <poblacion>Murcia</poblacion>
            <telefono>968765432</telefono>
            <email>contacto@empresaxyz.com</email>
        </membrete>
        <fecha>15/12/2013</fecha>
        <cliente>
            <dni>53945332F</dni>
            <nombre>Ana López</nombre>
            <direccion>Plaza de Buses</direccion>
            <codigoPostal>30002</codigoPostal>
            <poblacion>Murcia</poblacion>
        </cliente>
        <productos>
            <producto codigo="P004">
                <cantidad>1</cantidad>
                <descripcion>Monitor 144hz</descripcion>
                <precioUnitario>150</precioUnitario>
                <iva>21%</iva>
            </producto>
            <producto codigo="P005">
                <cantidad>2</cantidad>
                <descripcion>Alfombrilla RGB</descripcion>
                <precioUnitario>30</precioUnitario>
                <iva>21%</iva>
            </producto>
            <producto codigo="P006">
                <cantidad>2</cantidad>
                <descripcion>Silla Gamer</descripcion>
                <precioUnitario>150</precioUnitario>
                <iva>21%</iva>
            </producto>
        </productos>
        <resumen>
            <formaPago>transferencia</formaPago>
            <descuento>5%</descuento>
        </resumen>
    </factura>
</facturas>
